{
  "receipt_id": "receipt_demo_001",
  "task_id": "task_demo_001",
  "status": "completed",
  "overall_passed": true,
  "validator_score": 100,
  "cost_actual_usd": 0.4,
  "latency_ms": 1840,
  "requesting_agent_id": "agent_a",
  "specialist_agent_id": "agent_b",
  "result_hash": "sha256:demo",
  "signature_hash": "sha256:demo-receipt",
  "created_at": "2026-03-31T00:00:02Z",
  "validation": {
    "overall_passed": true,
    "checks": [
      {
        "type": "range_check",
        "passed": true,
        "detail": "Field 'risk_level' returned 'high'. Allowed values: low, medium, high, critical"
      }
    ]
  }
}
